{
  "semantic_contract_version": "v1",
  "contract_id": "business-status-one-page-semantic-v1",
  "template_request_id": "business-status-one-page-request-v1",
  "institution": "edudoc",
  "document_type": "사업 추진현황 1페이지 보고서",
  "elements": [
    { "element_id": "document_title", "role": "FIXED_TEXT", "text": "사업 추진현황 1페이지 보고서" },
    { "element_id": "as_of_label", "role": "FIXED_LABEL", "text": "기준일" },
    { "element_id": "as_of", "role": "CONTENT", "field_id": "as_of", "description": "보고 기준일", "required": true, "cardinality": "one", "content_type": "date" },
    { "element_id": "lead_department_label", "role": "FIXED_LABEL", "text": "주관 부서" },
    { "element_id": "lead_department", "role": "CONTENT", "field_id": "lead_department", "description": "사업 주관 부서", "required": true, "cardinality": "one", "content_type": "text" },
    { "element_id": "project_name_label", "role": "FIXED_LABEL", "text": "사업명" },
    { "element_id": "project_name", "role": "CONTENT", "field_id": "project_name", "description": "보고 대상 사업명", "required": true, "cardinality": "one", "content_type": "text" },
    { "element_id": "project_manager_label", "role": "FIXED_LABEL", "text": "담당자" },
    { "element_id": "project_manager", "role": "CONTENT", "field_id": "project_manager", "description": "실무 책임자", "required": true, "cardinality": "one", "content_type": "text" },
    { "element_id": "project_period_label", "role": "FIXED_LABEL", "text": "추진 기간" },
    { "element_id": "project_period", "role": "CONTENT", "field_id": "project_period", "description": "사업 추진 기간", "required": true, "cardinality": "one", "content_type": "date" },
    { "element_id": "summary_label", "role": "FIXED_LABEL", "text": "핵심 현황" },
    { "element_id": "summary", "role": "CONTENT", "field_id": "summary", "description": "사업의 현재 상태와 핵심 판단", "required": true, "cardinality": "one", "content_type": "text" },
    { "element_id": "project_tasks_name_label", "role": "FIXED_LABEL", "text": "과제명" },
    { "element_id": "project_tasks_stage_label", "role": "FIXED_LABEL", "text": "추진단계" },
    { "element_id": "project_tasks_progress_label", "role": "FIXED_LABEL", "text": "진행률" },
    { "element_id": "project_tasks_schedule_label", "role": "FIXED_LABEL", "text": "일정" },
    { "element_id": "project_tasks", "role": "CONTENT", "field_id": "project_tasks", "description": "과제별 추진 단계·진행률·일정", "required": false, "cardinality": "many", "content_type": "object", "item_fields": ["task_name", "stage", "progress", "schedule"] },
    { "element_id": "results_label", "role": "FIXED_LABEL", "text": "주요 성과 및 진척" },
    { "element_id": "results", "role": "CONTENT", "field_id": "results", "description": "완료·진척 성과", "required": true, "cardinality": "one", "content_type": "text" },
    { "element_id": "risk_summary_label", "role": "FIXED_LABEL", "text": "이슈 및 대응" },
    { "element_id": "risk_summary", "role": "CONTENT", "field_id": "risk_summary", "description": "현재 이슈와 대응 상태", "required": true, "cardinality": "one", "content_type": "text" },
    { "element_id": "next_actions_summary_label", "role": "FIXED_LABEL", "text": "향후 조치" },
    { "element_id": "next_actions_summary", "role": "CONTENT", "field_id": "next_actions_summary", "description": "향후 조치의 현재 계획 또는 공백 상태", "required": true, "cardinality": "one", "content_type": "text" },
    { "element_id": "next_actions", "role": "CONTENT", "field_id": "next_actions", "description": "다음 단계 실행 항목", "required": false, "cardinality": "many", "content_type": "object", "item_fields": ["text"] },
    { "element_id": "decision_request_label", "role": "FIXED_LABEL", "text": "의사결정·협조 요청" },
    { "element_id": "decision_request", "role": "CONTENT", "field_id": "decision_request", "description": "의사결정 또는 부서 협조 요청", "required": true, "cardinality": "one", "content_type": "text" }
  ]
}
